case_id,text,label,text_length,cleaned_text,cleaned_length
AILA_Q35,"Two appellants, who are brothers, along with their father P1 was prosecuted for an offence. Prosecution case in that the appellants have a sweetmeat shop in L1. PW 6 P2 is residing in a house opposite to the shop. On April 13, 1980, P1, the father of the appellants requested P2 to permit him to tie a rope of the canopy with the projection of the house of the witness, but he did not allow the same. P1 was offended. On April 18, 1980, a wet underwear drying-up on the roof flew away which was picked up by the first appellant P3. But when witness P2 demanded the same, the appellant had declined to return the same saying that he had found the same lying in the bazar and moreover he had not allowed his father to tie the rope. There was an exchange of abuses, but the matter ended there.In the evening on that day when P1 visited the shop of the appellants, P2 complained about the conduct of the first appellant P3.  However, P1 persuaded the first appellant to return the underwear of witness P2. At about 9.30 p.m. on that day deceased P4 accompanied by PW P5 visited the house of witness P2 for settling the details of the marriage that was to be performed in the near future. At about 10.00 p.m., deceased P4 and PW P5 left the house of witness P2. P2 followed them. When they reached the bazar locality, all the three of them saw the two appellants and P1 standing in front of their shop and on seeing deceased P4 and his companions, they raised chargers. P1 raised lalkaras and exhorted the appellants to catch hold of witness P2 and that he should not be allowed to escape. It is alleged that appellants 1 and 2, each of them was armed with a dagger. The first appellant P3 gave a blow with dagger on the left side of the chest of deceased P4, who fell down on the ground. When PW P5 rushed to the rescue of deceased P4, second appellant P7 gave two blows with a dagger and he also fell on the ground. Witness PW 8 P6 raised an alarm and the rickshaws to the hospital where on reaching the hospital P4 was pronounced dead by the Medical Officer who examined him. PW P5 was admitted in the hospital. PW 6 P2 lodged the first information report and the offence was registered. After completing the investigation, the appellants were prosecuted and tried for the offences hereinabove mentioned. At the trial PW P2 and PW P6 were examined as witnesses to the occurrence. PW 4 Dr. D1, who conducted the autopsy on the dead body of deceased P4 deposed that he found one incised stab wound 4 1/2 cm. x 2 1/2 cm. on front of left side of chest at 6 O'clock position, 3 1/2 cm. below left nipple oblique in direction. He also found two minor abrasions, one on front of left knee and the other on left side of fore-head. In his opinion, death was due to shock and haemorrhage as a result of injury to heart corresponding to injury No. 1 and in his opinion this injury was sufficient in the ordinary course of nature to cause death. The defence of the accused, the first appellant P3, was that he caused one single injury to deceased P4. He has given his own version of the incident to which we would presently refer. Appellant 2 and P1 denied having committed any offence. The learned Additional Sessions Judge rejected the defence version put forth by the first appellant P3 as unworthy of credit and held that the evidence of two witnesses P2 and P6 was reliable and is borne out by a part of the statement made by the first appellant P3 . He however rejected that the first appellant caused injury to P4 in furtherance of the common intention of all the accused. Accordingly, the second appellant P7 was held responsible for his own act of causing injury to PW P5. The Sessions Judge was not satisfied with regard to the participation of the third accused P1 and he was given benefit of doubt and acquitted. Accordingly, the first appellant P3 was convicted for an offence and was sentenced to suffer imprisonment for life and to pay a fine of Rs. 2000 in default to suffer further imprisonment for one year. Second appellant P7 was held guilty for an offence, and as he was aged about 17 years on the date of the occurrence with no previous conviction, he was given benefit of a provision. First and second appellant having been dissatisfied with the order of the Sessions Judge, appealed to the High Court. The High Court agreed with the findings recorded by the learned Additional Sessions Judge and confirmed the conviction and sentence of the appellants.",query,4463,"two appellants, who are brothers, along with their father p1 was prosecuted for an offence. prosecution case in that the appellants have a sweetmeat shop in l1. pw 6 p2 is residing in a house opposite to the shop. on april 13, 1980, p1, the father of the appellants requested p2 to permit him to tie a rope of the canopy with the projection of the house of the witness, but he did not allow the same. p1 was offended. on april 18, 1980, a wet underwear drying-up on the roof flew away which was picked up by the first appellant p3. but when witness p2 demanded the same, the appellant had declined to return the same saying that he had found the same lying in the bazar and moreover he had not allowed his father to tie the rope. there was an exchange of abuses, but the matter ended there.in the evening on that day when p1 visited the shop of the appellants, p2 complained about the conduct of the first appellant p3. however, p1 persuaded the first appellant to return the underwear of witness p2. at about 9.30 p.m. on that day deceased p4 accompanied by pw p5 visited the house of witness p2 for settling the details of the marriage that was to be performed in the near future. at about 10.00 p.m., deceased p4 and pw p5 left the house of witness p2. p2 followed them. when they reached the bazar locality, all the three of them saw the two appellants and p1 standing in front of their shop and on seeing deceased p4 and his companions, they raised chargers. p1 raised lalkaras and exhorted the appellants to catch hold of witness p2 and that he should not be allowed to escape. it is alleged that appellants 1 and 2, each of them was armed with a dagger. the first appellant p3 gave a blow with dagger on the left side of the chest of deceased p4, who fell down on the ground. when pw p5 rushed to the rescue of deceased p4, second appellant p7 gave two blows with a dagger and he also fell on the ground. witness pw 8 p6 raised an alarm and the rickshaws to the hospital where on reaching the hospital p4 was pronounced dead by the medical officer who examined him. pw p5 was admitted in the hospital. pw 6 p2 lodged the first information report and the offence was registered. after completing the investigation, the appellants were prosecuted and tried for the offences hereinabove mentioned. at the trial pw p2 and pw p6 were examined as witnesses to the occurrence. pw 4 dr. d1, who conducted the autopsy on the dead body of deceased p4 deposed that he found one incised stab wound 4 12 cm. x 2 12 cm. on front of left side of chest at 6 oclock position, 3 12 cm. below left nipple oblique in direction. he also found two minor abrasions, one on front of left knee and the other on left side of fore-head.",2716
AILA_Q36,"Interpretation and/or application of Medical Benefit Rules applicable in the State S1 as also in the State S2 is in question before us in these appeals which arise out of the judgment and order dated 20th June, 2005 passed by S1 High Court in Writ Petition No. 10942 and that of the judgment and order dated 4th August, 2005 passed by the S2 High Court in D.B. Civil Writ Petition No.6502 respectively.Respondent in the S1 case is an officer working in the Office of the Department of Commercial Taxes. He underwent 'Coronary Artery' Bypass Surgery in the Hospital H1 having been admitted on 19th June, 2000. A sum of Rs.1,50,600/- was said to have been incurred by him by way of medical expenses. He claimed re-imbursement thereof. State S1 sanctioned and reimbursed a sum of Rs.39,207/-. Feeling aggrieved, a writ petition was filed which, by reason of the impugned judgment, has been allowed. S2 case, relates to one P1, who was a Judicial officer. He had been suffering from some kidney problems. Respondent herein is his mother. P2 was being treated for renal failure in 1997. He was referred to Hospital H2 for kidney transplantation by the Hospital H3. However, as H2 showed its inability to admit him because of non-availability of bed. Transplantation of kidney was carried out in Hospital H4, in 1997. Respondent, who was also an employee of the State claimed reimbursement of the said medical expenses. However, a sum of Rs.50,000/- was allegedly found admissible for the purpose of reimbursement out of the total claim of a sum of Rs.2.11 lacs. Respondent, however, claimed that the entire sum may be reimbursed. Other medical expenses incurred by P2, as follow up measures, have been reimbursed to the respondent herein. P2 joined S1 Judicial Service in the year 2000. In February, 2003 he got himself treated in H4. Allegedly his case was not referred therefor by the H3. As he was not treated by H2, he filed a writ petition in the High Court of Delhi for a direction to admit him therein. However, because of an emergent situation, he got himself admitted in H4. The said writ petition was withdrawn. In the month of May, 2003 he again came and got himself admitted and treated in Hospital H4 at L1. He filed a representation before the Registrar General of the High Court of S2 that on account of the sudden demise of his maternal uncle, he had to go to L1 and as he fell ill there, went straightaway to Hospital H4. He, therefore, prayed for reimbursement of his medical expenses incurred on that occasion also. Indisputably, however, the Principal and Controller, Hospital H3, on or about 5th July, 2003, referred him to Hospital H1. Allegedly in the reference order it was mentioned that the same was subject to medical expenses with a ceiling of Rs.10,000/- only. P2 obtained treatment in the Hospital H4 from 4th July to 29th July, 2003. He unfortunately breathed his last on 7th November, 2003. Respondent claimed medical reimbursement to the tune of Rs.6,52,148/- with interest. Only a sum of Rs.75,000/- was, however, sanctioned by the State of Rajasthan as being admissible, purported to be in terms of the Rules.Feeling aggrieved, a writ petition was filed in the High Court of Rajasthan which by reason of the impugned judgment and order has been allowed directing :-As a result of the aforesaid discussion the writ petition succeeds and same is allowed. The respondents are directed to release the amount of Rs.6,52,148/- in favour of the Petitioner of the medical expenses bills of Hospital H4, P1, where his son late P2, an officer of the S1 Judicial Service was treated, within a period of two months from the date of receipt of the copy of this order. The respondents are further directed to pay to the petitioner on the aforesaid amount the interest at the rate of 6% per annum from the date of submission of the first medical bill for reimbursement of the amount of Hospital H4, New Delhi, till the payment thereof is made.""",query,3959,"interpretation andor application of medical benefit rules applicable in the state s1 as also in the state s2 is in question before us in these appeals which arise out of the judgment and order dated 20th june, 2005 passed by s1 high court in writ petition no. 10942 and that of the judgment and order dated 4th august, 2005 passed by the s2 high court in d.b. civil writ petition no.6502 respectively.respondent in the s1 case is an officer working in the office of the department of commercial taxes. he underwent coronary artery bypass surgery in the hospital h1 having been admitted on 19th june, 2000. a sum of rs.1,50,600- was said to have been incurred by him by way of medical expenses. he claimed re-imbursement thereof. state s1 sanctioned and reimbursed a sum of rs.39,207-. feeling aggrieved, a writ petition was filed which, by reason of the impugned judgment, has been allowed. s2 case, relates to one p1, who was a judicial officer. he had been suffering from some kidney problems. respondent herein is his mother. p2 was being treated for renal failure in 1997. he was referred to hospital h2 for kidney transplantation by the hospital h3. however, as h2 showed its inability to admit him because of non-availability of bed. transplantation of kidney was carried out in hospital h4, in 1997. respondent, who was also an employee of the state claimed reimbursement of the said medical expenses. however, a sum of rs.50,000- was allegedly found admissible for the purpose of reimbursement out of the total claim of a sum of rs.2.11 lacs. respondent, however, claimed that the entire sum may be reimbursed. other medical expenses incurred by p2, as follow up measures, have been reimbursed to the respondent herein. p2 joined s1 judicial service in the year 2000. in february, 2003 he got himself treated in h4. allegedly his case was not referred therefor by the h3. as he was not treated by h2, he filed a writ petition in the high court of delhi for a direction to admit him therein. however, because of an emergent situation, he got himself admitted in h4. the said writ petition was withdrawn. in the month of may, 2003 he again came and got himself admitted and treated in hospital h4 at l1. he filed a representation before the registrar general of the high court of s2 that on account of the sudden demise of his maternal uncle, he had to go to l1 and as he fell ill there, went straightaway to hospital h4. he, therefore, prayed for reimbursement of his medical expenses incurred on that occasion also. indisputably, however, the principal and controller, hospital h3, on or about 5th july, 2003, referred him to hospital h1. allegedly in the reference order it was mentioned that the same was subject to medical expenses with a ceiling of rs.10,000- only. p2 obtained treatment in the hospital h4 from 4th july to 29th july, 2003. he unfortunately breathed his last on 7th november, 2003. respondent claimed medical reimbursement to the tune of rs.6,52,148-",2979
AILA_Q37,"Appellants call in question legality of the judgment rendered by the High Court upholding conviction of the appellants (hereinafter referred to as the 'accused') and sentence as imposed by the trial Court which had sentenced each to undergo rigorous imprisonment for three months, two years and seven years respectively with separate fines for each of the alleged offences with default stipulations. Background facts leading to the trial of the accused appellants are as follows: The case was registered on the basis of information lodged by P1 (PW-6), which was recorded on 10.11.1989 at about 2.00 a.m. According to the informant, he and his son P2's wife P3 (PW- 7) were sitting in the courtyard of the house of P2 (hereinafter referred to as the 'deceased'). It was about 11.00 a.m. on 9.11.1989 when deceased was coming from the village after purchasing vegetables. When he reached near the house of P4, son of P5, P6 (A-1) armed with a Gandasi and P7 (A-2) armed with a lathi were present there. P7 made an obscene gesture. At this P7 and the deceased exchanged hot words and abused each other. P6 gave a Gandasi blow on the right hand of the deceased, which caused a grievous injury. P7 gave a lathi blow on the left foot of the deceased and also gave a thrust blow of lathi on the left side of his head. Deceased fell down on the ground. The occurrence was witnessed by P1 (PW-6) and P3 (PW-7). Both of them took P2 injured to their house. When P1 and P3 raised alarm, both the accused persons ran away from the spot. Since the condition of P2 became serious during the night time, he was taken to the Primary Health Centre. On 10.11.1989 at night at about 0.15 a.m. Dr.D1 examined P2. He found injury No.1 which was an incised wound in the middle phalanx of the index finger of right hand. The second injury was an abrasion on the lateral side of upper 1/3rd part of left leg and the patient complained of pain on different parts of the body. Dr.D1 sent information to the Police Station. ASI P7 reached the Primary Health Centre and recorded the statement of P1 which is the FIR. On the basis of this statement, FIR was recorded by ASI P8. P2 expired at about 1.50 a.m. on 10.11.1989. Hence, information to this effect was sent. The accused persons were charged for offences. The accused persons pleaded innocence and claimed trial. Eight persons were examined to further the prosecution case. P1 (PW-6) was the complainant and claimed to be an eye-witness. P3 (PW-7) wife of the deceased also claimed to be an eye-witness. Placing reliance on their evidence, the learned Additional Session Judge found the accused persons guilty and sentenced them to undergo sentences as noted above. In appeal, the High Court confirmed the conviction and the sentences. In support of the appeal, learned counsel for the accused appellants submitted that the prosecution version was based on testimonies of relatives and, therefore, does not inspire confidence. Further there was delay in lodging the FIR. Additionally, it was submitted that the sentences imposed were high.",query,3069,"appellants call in question legality of the judgment rendered by the high court upholding conviction of the appellants (hereinafter referred to as the accused) and sentence as imposed by the trial court which had sentenced each to undergo rigorous imprisonment for three months, two years and seven years respectively with separate fines for each of the alleged offences with default stipulations. background facts leading to the trial of the accused appellants are as follows: the case was registered on the basis of information lodged by p1 (pw-6), which was recorded on 10.11.1989 at about 2.00 a.m. according to the informant, he and his son p2s wife p3 (pw- 7) were sitting in the courtyard of the house of p2 (hereinafter referred to as the deceased). it was about 11.00 a.m. on 9.11.1989 when deceased was coming from the village after purchasing vegetables. when he reached near the house of p4, son of p5, p6 (a-1) armed with a gandasi and p7 (a-2) armed with a lathi were present there. p7 made an obscene gesture. at this p7 and the deceased exchanged hot words and abused each other. p6 gave a gandasi blow on the right hand of the deceased, which caused a grievous injury. p7 gave a lathi blow on the left foot of the deceased and also gave a thrust blow of lathi on the left side of his head. deceased fell down on the ground. the occurrence was witnessed by p1 (pw-6) and p3 (pw-7). both of them took p2 injured to their house. when p1 and p3 raised alarm, both the accused persons ran away from the spot. since the condition of p2 became serious during the night time, he was taken to the primary health centre. on 10.11.1989 at night at about 0.15 a.m. dr.d1 examined p2. he found injury no.1 which was an incised wound in the middle phalanx of the index finger of right hand. the second injury was an abrasion on the lateral side of upper 13rd part of left leg and the patient complained of pain on different parts of the body. dr.d1 sent information to the police station. asi p7 reached the primary health centre and recorded the statement of p1 which is the fir. on the basis of this statement, fir was recorded by asi p8. p2 expired at about 1.50 a.m. on 10.11.1989. hence, information to this effect was sent. the accused persons were charged for offences. the accused persons pleaded innocence and claimed trial. eight persons were examined to further the prosecution case. p1 (pw-6) was the complainant and claimed to be an eye-witness. p3 (pw-7) wife of the deceased also claimed to be an eye-witness. placing reliance on their evidence, the learned additional session judge found the accused persons guilty and sentenced them to undergo sentences as noted above. in appeal, the high court confirmed the conviction and the sentences. in support of the appeal, learned counsel for the accused appellants submitted that the prosecution version was based on testimonies of relatives and, therefore, does not inspire confidence. further",2958
AILA_Q38,"The appellant herein is a Senior Manager in a fertilizer company C1. The said company is engaged in manufacturing and selling of fertilizer. The Government of India in exercise of power has framed an order known as the Fertilizer (Control) Order, 1985 for controlling the quality of fertilizer. It appears that the samples of fertilizer sold by the appellant was taken from stitched bags of fertilizer and thereafter sent to laboratory for analysis. It is alleged that the laboratory reported that the fertilizer is sub-standard. It is further alleged that on the strength of the said report the respondent threatened the appellant to prosecute him. It is under such circumstances the appellant filed a petition before the High Court challenging the validity of Clause 19 of the Fertilizer (Control) Order. The case of the appellant was that since Clause 19 does not permit an accused a right to adduce evidence to contradict the report of the public analyst, the said clause is ultra vires articles of the Constitution. The said contention of the appellant was accepted by a Single Judge of the High Court. Consequently, Clause 19 of the Fertilizer (Control) Order was struck down. Aggrieved by the judgment of the learned Single Judge, the respondents preferred a letters patent appeal before the Division Bench of the High Court. The Letters Patent Bench, allowed the appeal and set aside the judgment of the learned Single Judge. It is against the said judgment of the High Court, the appellant is in appeal before us. It is not disputed that no charge-sheet on the strength of public analyst's report has been submitted to the Court against the appellant.",query,1660,"the appellant herein is a senior manager in a fertilizer company c1. the said company is engaged in manufacturing and selling of fertilizer. the government of india in exercise of power has framed an order known as the fertilizer (control) order, 1985 for controlling the quality of fertilizer. it appears that the samples of fertilizer sold by the appellant was taken from stitched bags of fertilizer and thereafter sent to laboratory for analysis. it is alleged that the laboratory reported that the fertilizer is sub-standard. it is further alleged that on the strength of the said report the respondent threatened the appellant to prosecute him. it is under such circumstances the appellant filed a petition before the high court challenging the validity of clause 19 of the fertilizer (control) order. the case of the appellant was that since clause 19 does not permit an accused a right to adduce evidence to contradict the report of the public analyst, the said clause is ultra vires articles of the constitution. the said contention of the appellant was accepted by a single judge of the high court. consequently, clause 19 of the fertilizer (control) order was struck down. aggrieved by the judgment of the learned single judge, the respondents preferred a letters patent appeal before the division bench of the high court. the letters patent bench, allowed the appeal and set aside the judgment of the learned single judge. it is against the said judgment of the high court, the appellant is in appeal before us. it is not disputed that no charge-sheet on the strength of public analysts report has been submitted to the court against the appellant.",1659
