case_id,text,label,text_length,cleaned_text,cleaned_length
AILA_Q1,"The appellant on February 9, 1961 was appointed as an Officer in Grade III in the respondent Bank ( for short 'the Bank'). He was promoted on April 1, 1968 to the Grade officer in the Foreign Exchange Department in the Head Office of the Bank. Sometime in 1964, MCH Society ( for short 'the Society') was formed of which the appellant was one of the chief promoters and thereafter its Secretary. The object of the Society was to construct residential premises for the employees of the Bank and its other members. It appears that the complaint was received in respect of the affairs of the Society relating to misappropriation of the funds of the Society and consequently, in exercise of the powers under Section S of Act A1, the Registrar on April 23, 1969 instituted an inquiry thereof. P1 was appointed the Registrar's nominee who on October 4, 1969; submitted the report holding the appellant and two other office bearers of the Society negligent in dealing with the funds of the Society causing a loss to the tune of Rs. 3,59,000/-. The Registrar on October 21, 1969, passed an order appointing an officer under Section S of A1 to assess the loss caused to the Society. However, the Government by its order dated November 29, 1969 annulled the Registrar's order dated April 23, 1969 and October 21, 1969 and directed a fresh inquiry into the affairs of the Society. On December 17, 1969, the Bank issued show cause notice to the appellant to explain within fifteen days his alleged negligent conduct in dealing with the affairs of the Society as revealed in the report dated 4th October, 1969. In the meantime, P2 came to be appointed by the Registrar vide his order dated 26th July, 1969, to make inquiries under Section S of A1. Petitioner by his reply dated 18/22th January, 1970 submitted his explanation and also challenged the legality of the inquiry and the findings recorded therein. On 5th March, 1970, P3, treasurer of the Society and an employee of the Bank criminal complaints in the Court of Addl. Chief Presidency Magistrate  alleging that the appellant and two other office bearers of the society had dishonestly misappropriated a sum of Rs. 51,000/ and Rs. 80,000/- respectively which was entrusted to the appellant in his capacity as Promoter and Secretary of the Society and thereby committed criminal breach of trust. The Magistrate framed the charges against the appellant. The Bank having regard to the serious misconduct of the appellant involving moral turpitude vide its order dated 3rd November, 1970 suspended the appellant pending trial. The appellant protested this action of the Bank complaining that he was not given an opportunity of hearing before passing the order of suspension. In the meantime, P2, the authorized officer appointed by the Registrar vide his order dated 9th October, 1971 held the appellant liable to pay Rs. 2,36,000/- to the Society in addition to the amount of Rs. 2,03,000/- for which he (the appellant) and two other office bearers of the Society were held jointly liable. The Bank in view of this finding, vide its order dated 29th November, 1971 terminated the services of the appellant with effect from 1st December, 1971 along with notice pay. The appellant protested against the Action of the Bank and on 3rd December, 1971 filed detailed representation against the order of termination. The Bank replied to the appellant's representation and justified its action. The appellant on 28th December, 1971 submitted his reply to the Bank stating, inter alia, that the termination of his services was not simplicitor and was in violation of the principles of natural justice; that no opportunity of hearing was given to him; that the termination order attached stigma. The appellant aggrieved by the findings and order made by P2 appealed before Tribunal. In the meantime, the criminal proceedings ended in conviction vide order dated 27th March, 1972 passed by the Addl. Chief Metropolitan Magistrate. The appellant challenged the order of conviction and sentence in the High Court  and during the pendency of the said appeal, the Tribunal vide its order dated April 12, 1973 dismissed the appellant's appeal but reduced the liability by Rs. 72,000/-. On November 12, 1973, the High Court allowed the criminal appeal and acquitted the appellant. The High Court, however, in its order observed that since the services of the appellant were terminated in view of the criminal proceedings and since the appellant has been acquitted, representation, if a any, by the appellant to the Bank for reinstatement may be considered sympathetically. Taking clue from the observations made by the High Court, the appellant filed three representations, the last being dated 3rd May, 1975 requesting the Bank to revoke the order of termination and be reinstated. The Bank vide its communication dated May 21, 1975 refused to reinstate the appellant. The appellant, therefore, on July 23, 1975 filed the writ petition in the High Court for quashing the orders dated 29th November 1971, 27th December, 1971 and 21st May, 1975 passed by the Bank. The learned Single Judge of the High Court by his judgment and order dated December 6/7, 1979 granted desired relief to the appellant. The Bank aggrieved by the judgment and order passed by the learned Single Judge preferred an appeal under Clause 15 of the Letters Patent. The appeal was heard by the Division Bench. The Division Bench of the High Court did not agree with the judgment passed by the learned Single Judge and consequently by its judgment and order dated April 16 1985 allowed the appeal and dismissed the writ petition the ground of laches and also on merits. It is this judgment and order of the High Court which is impugned in this appeal.",query,5748,"the appellant on february 9, 1961 was appointed as an officer in grade iii in the respondent bank ( for short the bank). he was promoted on april 1, 1968 to the grade officer in the foreign exchange department in the head office of the bank. sometime in 1964, mch society ( for short the society) was formed of which the appellant was one of the chief promoters and thereafter its secretary. the object of the society was to construct residential premises for the employees of the bank and its other members. it appears that the complaint was received in respect of the affairs of the society relating to misappropriation of the funds of the society and consequently, in exercise of the powers under section s of act a1, the registrar on april 23, 1969 instituted an inquiry thereof. p1 was appointed the registrars nominee who on october 4, 1969; submitted the report holding the appellant and two other office bearers of the society negligent in dealing with the funds of the society causing a loss to the tune of rs. 3,59,000-. the registrar on october 21, 1969, passed an order appointing an officer under section s of a1 to assess the loss caused to the society. however, the government by its order dated november 29, 1969 annulled the registrars order dated april 23, 1969 and october 21, 1969 and directed a fresh inquiry into the affairs of the society. on december 17, 1969, the bank issued show cause notice to the appellant to explain within fifteen days his alleged negligent conduct in dealing with the affairs of the society as revealed in the report dated 4th october, 1969. in the meantime, p2 came to be appointed by the registrar vide his order dated 26th july, 1969, to make inquiries under section s of a1. petitioner by his reply dated 1822th january, 1970 submitted his explanation and also challenged the legality of the inquiry and the findings recorded therein. on 5th march, 1970, p3, treasurer of the society and an employee of the bank criminal complaints in the court of addl. chief presidency magistrate alleging that the appellant and two other office bearers of the society had dishonestly misappropriated a sum of rs. 51,000 and rs. 80,000- respectively which was entrusted to the appellant in his capacity as promoter and secretary of the society and thereby committed criminal breach of trust. the magistrate framed the charges against the appellant. the bank having regard to the serious misconduct of the appellant involving moral turpitude vide its order dated 3rd november, 1970 suspended the appellant pending trial. the appellant protested this action of the bank complaining that he was not given an opportunity of hearing before passing the order of suspension. in the meantime, p2, the authorized officer appointed by the registrar vide his order dated 9th october, 1971 held the appellant liable to pay rs. 2,36,000- to the society in addition to the amount of rs. 2,03,000- for which he (the appellant) and two other office bearers of the society were held jointly",3011
AILA_Q2,"The appellant before us was examined as prime witness in the trial of T.R. on the file of the Special Judge against the first respondent. The trial ended in conviction against the first respondent and when the appeal filed by him came to be heard by the High Court the appellant had become a Cabinet Minister. On account of the disparaging remarks made by the Appellate Judge the appellant tendered his resignation and demitted office for maintaining democratic traditions. It is in that backgroud this appeal has come to be preferred. Pursuant to a trap laid by the Vigilance Police on the complaint of the appellant's Manager, P1 (P.W.2) the first respondent was arrested on 26.4.79 for having accepted a bribe of Rs. 2,000 from P1. The marked currency notes were recovered from the brief case of the first respondent prior to the arrest. The prosecution case was that the first respondent had been extracting illegal gratification at the rate of Rs. 1,000 er month during the months of January, February and March, 1979 from P1 but all of a sudden he raised the demand to Rs. 2,000 per month in April 1979 and this led to P1 laying information (Exhibit I) before the Superintendent of Police (Vigilance). Acting on the report, a trap was laid on 26.4.79 and after P1 had handed over the marked currency notes the Vigilance party entered the office and recovered the currency notes from the brief case and arrested the first respondent. The first respondent denied having received any illegal gratification but offered no explanation for the presence of the currency notes in his brief case. Eleven witnesses including the appellant who figured as P.W.8 were examined by the prosecution and the first respondent examined three witnesses D.Ws. 1 to 3 to substantiate the defence set up by him, viz., that the sum of Rs. 2,000 had been paid by way of donation for conducting a drama and publishing a souvenir by the Mining Officers' Club and also towards donation for Children's Welfare Fund.The Special Judge accepted the prosecution case and held the first respondent guilty. The Special Judge awarded a sentence of rigorous imprisonment for one year for the conviction under the first charge but did not award any separate sentence for the conviction under the second. Against the conviction and sentence the first respondent appealed to the High Court. A learned Judge of the High Court has allowed the appeal holding that the prosecution has not proved its case by acceptable evidence and besides, the first respondent's explanation for the possession of the currency notes appeared probable. While acquitting the first respondent the learned Judge has, however, made several adverse remarks about the conduct of the appellant and about the credibility of his testimony and it is with that part of the judgment we are now concerned with in this appeal.",query,2857,"the appellant before us was examined as prime witness in the trial of t.r. on the file of the special judge against the first respondent. the trial ended in conviction against the first respondent and when the appeal filed by him came to be heard by the high court the appellant had become a cabinet minister. on account of the disparaging remarks made by the appellate judge the appellant tendered his resignation and demitted office for maintaining democratic traditions. it is in that backgroud this appeal has come to be preferred. pursuant to a trap laid by the vigilance police on the complaint of the appellants manager, p1 (p.w.2) the first respondent was arrested on 26.4.79 for having accepted a bribe of rs. 2,000 from p1. the marked currency notes were recovered from the brief case of the first respondent prior to the arrest. the prosecution case was that the first respondent had been extracting illegal gratification at the rate of rs. 1,000 er month during the months of january, february and march, 1979 from p1 but all of a sudden he raised the demand to rs. 2,000 per month in april 1979 and this led to p1 laying information (exhibit i) before the superintendent of police (vigilance). acting on the report, a trap was laid on 26.4.79 and after p1 had handed over the marked currency notes the vigilance party entered the office and recovered the currency notes from the brief case and arrested the first respondent. the first respondent denied having received any illegal gratification but offered no explanation for the presence of the currency notes in his brief case. eleven witnesses including the appellant who figured as p.w.8 were examined by the prosecution and the first respondent examined three witnesses d.ws. 1 to 3 to substantiate the defence set up by him, viz., that the sum of rs. 2,000 had been paid by way of donation for conducting a drama and publishing a souvenir by the mining officers club and also towards donation for childrens welfare fund.the special judge accepted the prosecution case and held the first respondent guilty. the special judge awarded a sentence of rigorous imprisonment for one year for the conviction under the first charge but did not award any separate sentence for the conviction under the second. against the conviction and sentence the first respondent appealed to the high court. a learned judge of the high court has allowed the appeal holding that the prosecution has not proved its case by acceptable evidence and besides, the first respondents explanation for the possession of the currency notes appeared probable. while acquitting the first respondent the learned judge has, however, made several adverse remarks about the conduct of the appellant and about the credibility of his testimony and it is with that part of the judgment we are now concerned with in this appeal.",2853
AILA_Q3,"This appeal arises from the judgment of the learned Single Judge of High Court dated 6th June, 1988 whereby the learned Single Judge declined to quash the prosecution of the petitioner. The petitioner therein has been prosecuted for selling adulterated supari on the basis of a certificate issued by the Director of Central Food Laboratory showing that the article of Food purchased from the accused contained 2000 mgs/kg. saccharin and that the sample does not conform to the standard rules. The High Court took the view the report prima facie goes to show that accused has sold adulterated article of food and consequently declined to quash the prosecution. This appeal is directed against the order of the High Court accepting the appeal against the order of acquittal passed by the Chief Judicial Magistrate. The appeal was filed against the acquittal of accused Nos. 2 and 3 therein and out of whom one is the appellant before us. The High Court confirmed the acquittal of second accused but sentenced the appellant before us to undergo simple imprisonment for six month and to pay a fine of Rs. 1,000 with a default sentence of simple imprisonment for two more months.",query,1174,"this appeal arises from the judgment of the learned single judge of high court dated 6th june, 1988 whereby the learned single judge declined to quash the prosecution of the petitioner. the petitioner therein has been prosecuted for selling adulterated supari on the basis of a certificate issued by the director of central food laboratory showing that the article of food purchased from the accused contained 2000 mgskg. saccharin and that the sample does not conform to the standard rules. the high court took the view the report prima facie goes to show that accused has sold adulterated article of food and consequently declined to quash the prosecution. this appeal is directed against the order of the high court accepting the appeal against the order of acquittal passed by the chief judicial magistrate. the appeal was filed against the acquittal of accused nos. 2 and 3 therein and out of whom one is the appellant before us. the high court confirmed the acquittal of second accused but sentenced the appellant before us to undergo simple imprisonment for six month and to pay a fine of rs. 1,000 with a default sentence of simple imprisonment for two more months.",1173
AILA_Q4,"The Petitioner was married to the Respondent No.2, on 27th November, 2005, as per Hindu traditions and customs. At the time of marriage 12 lakhs in cash, 45 sovereigns of gold and 50,000/- is alleged to have been given to the Accused Nos.1 to 4, who are the husband, the mother-in-law and other relatives of the husband. According to the Respondent No.2, the Petitioner left India for place L1 in January 2006 without taking her along with him. However, in February, 2006, the Respondent No.2 went to place L1 to join the Petitioner. While in place L1, the Respondent No.2 is alleged to have been severely ill-treated by the Petitioner and apart from the above, various demands were also made including a demand for additional dowry of 5 lakhs. On account of such physical and mental torture not only by the Petitioner/husband, but also by his immediate relatives, who continued to demand additional dowry by way of phone calls, the Respondent No.2 addressed a complaint to the Superintendent of Police, from place L1 and the same was registered as Case (Crl.) No.25 by the Station House Officer on the instructions of the Superintendent of Police. Upon investigation into the complaint filed by the Respondent No.2, the Inspector of Police, filed a charge-sheet in CC No.307 in the Court of the Additional Munsif Magistrate against the Petitioner and his father, mother and sister, who were named as Accused Nos.2, 3 and 4. The learned Magistrate took cognizance of the aforesaid case and by his order dated 19th February, 2007, ordered issuance of summons against the accused. The cognizance taken by the learned Magistrate was questioned by the Petitioner and the other co-accused before the High Court and a prayer was made for quashing of the same. The High Court by its order dated 27th August, 2008, allowed Criminal Petition No.2746 of 2008 filed by the Accused Nos.2 to 4 and quashed the proceedings against them. However, Criminal Petition No.3629 of 2008 filed by the Petitioner herein was dismissed. The present Special Leave Petition is directed against the said order of the High Court rejecting the Petitioner's petition and declining to quash Complaint Case No. 307 initiated against him.",query,2204,"the petitioner was married to the respondent no.2, on 27th november, 2005, as per hindu traditions and customs. at the time of marriage 12 lakhs in cash, 45 sovereigns of gold and 50,000- is alleged to have been given to the accused nos.1 to 4, who are the husband, the mother-in-law and other relatives of the husband. according to the respondent no.2, the petitioner left india for place l1 in january 2006 without taking her along with him. however, in february, 2006, the respondent no.2 went to place l1 to join the petitioner. while in place l1, the respondent no.2 is alleged to have been severely ill-treated by the petitioner and apart from the above, various demands were also made including a demand for additional dowry of 5 lakhs. on account of such physical and mental torture not only by the petitionerhusband, but also by his immediate relatives, who continued to demand additional dowry by way of phone calls, the respondent no.2 addressed a complaint to the superintendent of police, from place l1 and the same was registered as case (crl.) no.25 by the station house officer on the instructions of the superintendent of police. upon investigation into the complaint filed by the respondent no.2, the inspector of police, filed a charge-sheet in cc no.307 in the court of the additional munsif magistrate against the petitioner and his father, mother and sister, who were named as accused nos.2, 3 and 4. the learned magistrate took cognizance of the aforesaid case and by his order dated 19th february, 2007, ordered issuance of summons against the accused. the cognizance taken by the learned magistrate was questioned by the petitioner and the other co-accused before the high court and a prayer was made for quashing of the same. the high court by its order dated 27th august, 2008, allowed criminal petition no.2746 of 2008 filed by the accused nos.2 to 4 and quashed the proceedings against them. however, criminal petition no.3629 of 2008 filed by the petitioner herein was dismissed. the present special leave petition is directed against the said order of the high court rejecting the petitioners petition and declining to quash complaint case no. 307 initiated against him.",2201
