case_id,text,label,text_length,cleaned_text,cleaned_length
AILA_Q13,"This is an appeal with a certificate granted by the judicial Commissioner. P1-hereinafter referred to as the respondent'-was appointed a constable in the Police Force of L1 by the Superintendent of Police, L2 by order dated April 18, 1954. The employment was temporary and was liable to be terminated with one month's notice. On December 6, 1957, the Superintendent of Police, informed the respondent that his services ""'will be terminated with effect from 6-1-58 A. M."" The respondent presented an appeal to the Chief Commissioner against the order of termination. By letter dated April 11, 1958 the respondent was informed that as he was ""an Ex convict for theft, nothing can be done for him"". In reply to another application addressed to the Chief Commissioner the respondent was informed by letter dated May 26, 1958, that he was already informed in connection with his previous appeal that as he was ""'an Ex convict in a case of theft"" he ""cannot be reemployed by the Administration."" The respondent then filed in the Court of the Judicial Commissioner, L1, a petition for a writ praying for a writ declaring that the order of the Superintendent of Police terminating his service was ""illegal"" and for a writ of mandamus or a writ of certiorari directing the Chief Commissioner not to enforce the said order and for an order reinstating him in the Police Force of the L1 Administration with retros pective effect. The L1 Administration submitted in rejoinder that the respondent being a temporary employee of the Police Force, his services were lawfully terminated. The Judicial Commissioner of L1 held that the respondent was a temporary employee, but the order terminating the respondent's employment was invalid for it infringed the constitutional guarantee of protection of public servants which applied to temporary as well as permanent public servants. In the view of the judicial Commissioner, termination of employment of a temporary servant  will not per se be treated as a punishment of dismissal or removal, but it is open to the Court even if an order merely of termination of employment of a temporary employee is passed to ascertain whether the order was intended to be of termination simpliciter or of dismissal entailing penal consequences, and that the order dated April 11, 1958, of the Chief Commissioner passed in appeal clearly indicated that the order of the Superintendent of Police was one imposing penalty. He observed: ""This reply (dated April 11, 1958) will clearly indicate that though the Superintendent of Police purported to terminate his service, he meant to dismiss the petitioner from am service as a punishment on the ground that he was an ex-convict and that it was intended that he should not be reappointed in future in any department of the Government. Thus it cannot be gainsaid that the termination was in fact a punishment for previous misconduct debarring the petitioner from being, employed even in the future, and that in passing the innocuous order (dated December 6, 1957Annexure D), the Superintendent was really camouflaging his real intention. The real intention came to light, perhaps as the result of an oversight in communicating the orders in appeal to the petitioner"".",query,3228,"this is an appeal with a certificate granted by the judicial commissioner. p1-hereinafter referred to as the respondent-was appointed a constable in the police force of l1 by the superintendent of police, l2 by order dated april 18, 1954. the employment was temporary and was liable to be terminated with one months notice. on december 6, 1957, the superintendent of police, informed the respondent that his services will be terminated with effect from 6-1-58 a. m. the respondent presented an appeal to the chief commissioner against the order of termination. by letter dated april 11, 1958 the respondent was informed that as he was an ex convict for theft, nothing can be done for him. in reply to another application addressed to the chief commissioner the respondent was informed by letter dated may 26, 1958, that he was already informed in connection with his previous appeal that as he was an ex convict in a case of theft he cannot be reemployed by the administration. the respondent then filed in the court of the judicial commissioner, l1, a petition for a writ praying for a writ declaring that the order of the superintendent of police terminating his service was illegal and for a writ of mandamus or a writ of certiorari directing the chief commissioner not to enforce the said order and for an order reinstating him in the police force of the l1 administration with retros pective effect. the l1 administration submitted in rejoinder that the respondent being a temporary employee of the police force, his services were lawfully terminated. the judicial commissioner of l1 held that the respondent was a temporary employee, but the order terminating the respondents employment was invalid for it infringed the constitutional guarantee of protection of public servants which applied to temporary as well as permanent public servants. in the view of the judicial commissioner, termination of employment of a temporary servant will not per se be treated as a punishment of dismissal or removal, but it is open to the court even if an order merely of termination of employment of a temporary employee is passed to ascertain whether the order was intended to be of termination simpliciter or of dismissal entailing penal consequences, and that the order dated april 11, 1958, of the chief commissioner passed in appeal clearly indicated that the order of the superintendent of police was one imposing penalty. he observed: this reply (dated april 11, 1958) will clearly indicate that though the superintendent of police purported to terminate his service, he meant to dismiss the petitioner from am service as a punishment on the ground that he was an ex-convict and that it was intended that he should not be reappointed in future in any department of the government. thus it cannot be gainsaid that the termination was in fact a punishment for previous misconduct debarring the petitioner from being, employed even in the future, and that in passing the innocuous order (dated december 6, 1957annexure d), the superintendent was really camouflaging his real intention. the real intention came to",3108
AILA_Q14,"P1 is before us being aggrieved by and dissatisfied with the judgment and order dated 17.10.2005 passed by a Division Bench of the High Court. Appellant herein along with P2 (Accused No.1), P3 (Accused No. 3) and P4 (Accused No.4) were tried for committing the murder of one P5. P5 was an accused in a case of murder of the father of the appellant and accused No. 3. Allegedly, when cremation was taking place, the appellant took a vow to take revenge of murder of his father. P5 (deceased) on or about 13.02.1991 at about 11.00 a.m. was going to L1 on a motorcycle. He was accompanied by P6 (PW-4). When they were at distance of about 3 k.m. from P1, the accused persons who were in a Maruti van parked the vehicle by the side of road got down. The motorcycle was stopped by Accused Nos. 2, 3 and 4. P3 (Accused No. 3) is said to have caught hold P5 and P6 (Accused No.2) and P4 (Accused No. 4) inflicted stab injuries with knives. An attempt to rescue the deceased by PW-4 resulted in a threat to him, whereupon he started running towards Jalgaon. Bhaulal also tried to save himself by running away from the said place. He was chased by Accused Nos. 2 and 3 and was again assaulted with knives. PW-4 immediately went to the Taluka Police Station on a vehicle of a passer by. A First Information Report was lodged at about 11.45 a.m. P5 was taken to the hospital in a tractor. At about 12.45 p.m. he died. At the trial, the prosecution examined 17 witnesses. P6 (PW-4) and P7 (PW-5) were examined as eye- witnesses to the occurrence. We have noticed hereinbefore that PW-4 was the informant. PW-5 was the driver of the Maruti van, which was taken on hire by the accused persons. They had gone to L2 and L3. The learned Trial Judge upon considering the evidence brought on record convicted all the accused persons. The High Court by reason of the impugned judgment in the criminal appeal filed by the accused persons, however, set aside the conviction and sentence of Accused No.1. Accused Nos. 2, 3 and 4. Accused Nos. 2 and 3 were also convicted under Section 341 read with Section 34 IPC. Accused No. 2 was further convicted under Section 506 IPC. Indisputably, P1 preferred an appeal before this Court against the said judgment of conviction and sentence passed by the High Court.",query,2284,"p1 is before us being aggrieved by and dissatisfied with the judgment and order dated 17.10.2005 passed by a division bench of the high court. appellant herein along with p2 (accused no.1), p3 (accused no. 3) and p4 (accused no.4) were tried for committing the murder of one p5. p5 was an accused in a case of murder of the father of the appellant and accused no. 3. allegedly, when cremation was taking place, the appellant took a vow to take revenge of murder of his father. p5 (deceased) on or about 13.02.1991 at about 11.00 a.m. was going to l1 on a motorcycle. he was accompanied by p6 (pw-4). when they were at distance of about 3 k.m. from p1, the accused persons who were in a maruti van parked the vehicle by the side of road got down. the motorcycle was stopped by accused nos. 2, 3 and 4. p3 (accused no. 3) is said to have caught hold p5 and p6 (accused no.2) and p4 (accused no. 4) inflicted stab injuries with knives. an attempt to rescue the deceased by pw-4 resulted in a threat to him, whereupon he started running towards jalgaon. bhaulal also tried to save himself by running away from the said place. he was chased by accused nos. 2 and 3 and was again assaulted with knives. pw-4 immediately went to the taluka police station on a vehicle of a passer by. a first information report was lodged at about 11.45 a.m. p5 was taken to the hospital in a tractor. at about 12.45 p.m. he died. at the trial, the prosecution examined 17 witnesses. p6 (pw-4) and p7 (pw-5) were examined as eye- witnesses to the occurrence. we have noticed hereinbefore that pw-4 was the informant. pw-5 was the driver of the maruti van, which was taken on hire by the accused persons. they had gone to l2 and l3. the learned trial judge upon considering the evidence brought on record convicted all the accused persons. the high court by reason of the impugned judgment in the criminal appeal filed by the accused persons, however, set aside the conviction and sentence of accused no.1. accused nos. 2, 3 and 4. accused nos. 2 and 3 were also convicted under section 341 read with section 34 ipc. accused no. 2 was further convicted under section 506 ipc. indisputably, p1 preferred an appeal before this court against the said judgment of conviction and sentence passed by the high court.",2284
AILA_Q15,"The appellants are five in number and they have filed this appeal as of right. They were acquitted by the trial court but convicted by the High Court on appeal filed by the State, besides the offence of rioting. On the first count they were each sentenced to imprisonment for life besides fine and to lesser sentences for the lesser offence. The gist of the case against them is that all the five accused formed themselves into an unlawful assembly on the evening of 24-10-1985 and lay in ambush waiting for P1 (deceased) to come through the road and on seeing P1 they all launched an attack with weapons like gandasa, takua and ghope. The wife of P1 (P2, PW 10) who accompanied her husband made a bid to rescue her husband from the onslaughts of the assailants, but she too was attacked by them. P1 died at the spot. PW 10 (P2) furnished first information to the police on the same evening on the basis of which FIR was registered by the police. Subsequently all the five accused were arrested and on the strength of the information elicited from Ist accused P3 and third accused P4 weapons of offences were recovered from concealed places. The most important witness in this case is PW 10 (P2). The importance of her evidence is that no court can possibly hold that she would not have witnessed the occurrence, for she herself sustained as many as eight injuries, some of them serious, during the occurrence. The fact that she gave the police prompt information which has reached the Magistrate on the very same night adds further credence to her version. Added to that, she narrated the incident to PW 12 and PW 13 (a chowkidar) who reached the spot soon after the occurrence. The trial court did not place reliance on the evidence of PW 10 (P2) principally on the ground that her evidence did not agree with the testimony of PW 11 (JoP4). It must be pointed out that JoP4 was cited as an eyewitness and he turned hostile and the Public Prosecutor confronted him with his own previous statements and contradicted him. It is not safe to jettison the evidence of a witness like PW 10 (P2) as important as she is in the syndrome of the facts of this case, with the aid of a hostile witness's stance in the Court. Such a course adopted by the trial court had been rightly deprecated by the High Court. The defence version was that PW 10 would have possibly sustained those injuries at some other place and at some other time and not when she was accompanying her husband at the place of occurrence. Such a suggestion is too unconvincing and very far-fetched. No court can give any weight to such a theory. Even the defence admitted that PW 10 sustained so many injuries as described by PW 1 Dr D1 in his evidence. We are totally disinclined to countenance the contention that PW 10 would have absolved those who have attacked her and turned against the five accused falsely. Such a theory will not fit in with logic and common sense. But unfortunately that version was found acceptable to the trial court and therefore the High Court has rightly repelled it.",query,3057,"the appellants are five in number and they have filed this appeal as of right. they were acquitted by the trial court but convicted by the high court on appeal filed by the state, besides the offence of rioting. on the first count they were each sentenced to imprisonment for life besides fine and to lesser sentences for the lesser offence. the gist of the case against them is that all the five accused formed themselves into an unlawful assembly on the evening of 24-10-1985 and lay in ambush waiting for p1 (deceased) to come through the road and on seeing p1 they all launched an attack with weapons like gandasa, takua and ghope. the wife of p1 (p2, pw 10) who accompanied her husband made a bid to rescue her husband from the onslaughts of the assailants, but she too was attacked by them. p1 died at the spot. pw 10 (p2) furnished first information to the police on the same evening on the basis of which fir was registered by the police. subsequently all the five accused were arrested and on the strength of the information elicited from ist accused p3 and third accused p4 weapons of offences were recovered from concealed places. the most important witness in this case is pw 10 (p2). the importance of her evidence is that no court can possibly hold that she would not have witnessed the occurrence, for she herself sustained as many as eight injuries, some of them serious, during the occurrence. the fact that she gave the police prompt information which has reached the magistrate on the very same night adds further credence to her version. added to that, she narrated the incident to pw 12 and pw 13 (a chowkidar) who reached the spot soon after the occurrence. the trial court did not place reliance on the evidence of pw 10 (p2) principally on the ground that her evidence did not agree with the testimony of pw 11 (jop4). it must be pointed out that jop4 was cited as an eyewitness and he turned hostile and the public prosecutor confronted him with his own previous statements and contradicted him. it is not safe to jettison the evidence of a witness like pw 10 (p2) as important as she is in the syndrome of the facts of this case, with the aid of a hostile witnesss stance in the court. such a course adopted by the trial court had been rightly deprecated by the high court. the defence version was that pw 10 would have possibly sustained those injuries at some other place and at some other time and not when she was accompanying her husband at the place of occurrence. such a suggestion is too unconvincing and very far-fetched. no court can give any weight to such a theory. even the defence admitted that pw 10 sustained so many injuries as described by pw 1 dr d1 in his evidence. we are totally disinclined to countenance the contention that pw 10 would have absolved those who have attacked her and",2831
AILA_Q16,"The appellant P1 is convicted by the Additional Sessions Judge by judgment and order dated 5th/9th August, 1991 and was sentenced to death subject to confirmation by the High Court. Appellant appealed against the conviction and sentence which was partly allowed. The order with regard to the death penalty was set aside and appellant was sentenced to suffer imprisonment for life and to pay a fine of Rs.5,000/- in default thereof to undergo R.I. for 18 months. Against the said judgment and order this appeal is filed. The prosecution version as stated by P.W.1 is that he was a resident of Delhi and was dealer and manufacturer of Umbrellas; he has got two wives known as P2 and P3. His first wife P2 is residing at House No. 377 alongwith her three children, named, P4, P5 and P6 and her other three children have been residing with him at his House No.1584. They are P1 (appellant), P7 and P8. His second wife P3 (deceased) had been residing with him alongwith her six children including daughter P9 aged 17 years (deceased). He was also having a house where his first wife was residing earlier before she shifted. There was dispute between him on the one hand and his wife P2 and her children on the other with regard to the house. The appellant-accused and his brother were insisting for the transfer of the said house in the name of their mother at the earliest. For transferring the said house in the name of his first wife, he went to Tis Hazari on 17th October, 1988 alongwith his son-in-law P10 and met his counsel who advised him to come on the next day. Hence, the said property could not be transferred in the name of his wife. At about 6.00 P.M., when he was sleeping in the house, he woke up on hearing the noise of a quarrel and P8, daughter of P2 abusing P3. He slapped P8 and asked her to desist from abusing P3. After this the appellant and P7 came into the house, P7 went inside the room alongwith P8 and then came out with a dagger. P7 abused him and stabbed on his left eye, he fell down. At that time, P3 intervened and protested saying as to why he was beating his handicapped father. At that time, appellant snatched away dagger from P7 and started stabbing P3 repeatedly. At that stage, his daughter P9 intervened and asked the appellant as to why he was stabbing P3. P7 stated that she was the root of all troubles so the appellant started stabbing P9 at her abdomen, neck and other parts of her body. After sometime when persons collected outside, the appellant ran away. Within minutes P3 and P9 died at the spot. Police recorded the statement of P.W.1 as FIR. Appellant as well as his brother P7 were chargesheeted. P7 was convicted. He has not preferred any appeal against his conviction. After considering the evidence of the prosecution witnesses particularly P.W.1, P.W.2 and P.W.4 who have unequivocally deposed that both the deceased persons were killed by the appellant by inflicting dagger blows, the High Court has rightly arrived at the conclusion that accused is guilty for the offence for which he is charged. Mr. R.K. Jain, learned senior counsel for the appellant, has not raised any contention with regard to the conviction of the appellant.",query,3187,"the appellant p1 is convicted by the additional sessions judge by judgment and order dated 5th9th august, 1991 and was sentenced to death subject to confirmation by the high court. appellant appealed against the conviction and sentence which was partly allowed. the order with regard to the death penalty was set aside and appellant was sentenced to suffer imprisonment for life and to pay a fine of rs.5,000- in default thereof to undergo r.i. for 18 months. against the said judgment and order this appeal is filed. the prosecution version as stated by p.w.1 is that he was a resident of delhi and was dealer and manufacturer of umbrellas; he has got two wives known as p2 and p3. his first wife p2 is residing at house no. 377 alongwith her three children, named, p4, p5 and p6 and her other three children have been residing with him at his house no.1584. they are p1 (appellant), p7 and p8. his second wife p3 (deceased) had been residing with him alongwith her six children including daughter p9 aged 17 years (deceased). he was also having a house where his first wife was residing earlier before she shifted. there was dispute between him on the one hand and his wife p2 and her children on the other with regard to the house. the appellant-accused and his brother were insisting for the transfer of the said house in the name of their mother at the earliest. for transferring the said house in the name of his first wife, he went to tis hazari on 17th october, 1988 alongwith his son-in-law p10 and met his counsel who advised him to come on the next day. hence, the said property could not be transferred in the name of his wife. at about 6.00 p.m., when he was sleeping in the house, he woke up on hearing the noise of a quarrel and p8, daughter of p2 abusing p3. he slapped p8 and asked her to desist from abusing p3. after this the appellant and p7 came into the house, p7 went inside the room alongwith p8 and then came out with a dagger. p7 abused him and stabbed on his left eye, he fell down. at that time, p3 intervened and protested saying as to why he was beating his handicapped father. at that time, appellant snatched away dagger from p7 and started stabbing p3 repeatedly. at that stage, his daughter p9 intervened and asked the appellant as to why he was stabbing p3. p7 stated that she was the root of all troubles so the appellant started stabbing p9 at her abdomen, neck and other parts of her body. after sometime when persons collected outside, the appellant ran away. within minutes p3 and p9 died at the spot. police recorded the statement of p.w.1 as fir. appellant as well as his brother p7 were chargesheeted. p7 was convicted. he has not preferred any appeal against his conviction. after considering the evidence of the prosecution witnesses particularly p.w.1, p.w.2 and p.w.4 who have unequivocally deposed that both",2855
