case_id,text,label,text_length,cleaned_text,cleaned_length
AILA_Q24,"These appeals are directed against the judgment of a High Court whereby an appeal and a criminal revision were disposed of. The appellants were found guilty and sentenced to undergo various terms of sentences. The Criminal Appeal was filed by three appellants questioning the conviction and sentence as recorded. Complainant filed a revision petition stating that she was entitled to compensation. Background facts giving rise to the trial are essentially as follows: ""The complainant and the appellants are first cousins, and as such are closely related to each other. Their grandfather was P1. As per site plans Ex. PP prepared by P2, P3 PW4 and Ex. PT prepared by P3 PW9 (I.0.), it shows that the place of occurrence was in the common land owned both by the appellants and the complainant party. The tube well of which the pipes were being taken out by the appellants, was also in the common piece of land. P4 (hereinafter referred to as 'deceased') was standing in the water-course point B (Ex.PT). Complainant P5 was standing in the common land Point C (Ex.PT) and P6 was standing at Point D (Ex. PT). It is the appellants who went 16 to 35 feet towards the complainants where deceased P4 and the other two witnesses P5 (PW6) and P6 (PW7) were standing and thereafter attacked them. P5 (PW6) asked the appellants not to take out the iron and plastic pipes of the tube well, but firstly to talk to the elders. Malkiat Singh, Patwari (PW4), who is a key witness in regard to the ownership of the piece of land where the tubewell was installed, was not put any question regarding the ownership of the common land. P5 (PW6), in his testimony before the Court, stated that the appellants on 7.1.2001 at about 1.00 P.M. armed with spades came to the tube well and started removing the pipes, which was jointly owned by both the appellants and complainant party. On being stopped, the appellants felt offended and attacked the complainant party. He (PW6) has further stated that there was no dispute regarding the joint property, but the appellants were not on visiting terms with them as far social functions were concerned. P4 was attacked in the joint water channel and across the water channel there was the field of P7, father of P8. After leaving the common pipes of land where the tube well was installed, rest of the land had been divided by both the parties and they were cultivating the land separately and peacefully. The complainant party did not have any weapons in their hands when they had gone to stop the appellants. This witness (PW6) has stated that they did not go near the appellants, but asked them not to remove the pipes. They were at that time standing at a distance of 5-6 karms. P6 (PW7) has also reiterated the same. P5 (PW6) has stated, that P9 and P10 have their fields at a distance of about half a kills from the place of occurrence. Both these witnesses P5 (PW6) and P6 (PW7) corroborate each other inter-se and also corroborate the FIR The medical evidence also corroborates the statements given by the eye witnesses. Dr. D1 (PW 1) has stated in his testimony, that on examining P5 he found that he had received one incised wound injury on the scalp left parietal area vertical in position. Similarly on examining P6, he found the first injury to be an incised wound. Second and third were abrasions on the left shoulder and neck. The fourth injury was a lacerated wound on the right parietal area of scalp. On the post-mortem conducted on P4, an incised wound was found on the parietal area of the scalp, about 12 cms from right ear pinna backwards, traversing part of left parietal area of scalp to left occipital area. The medical evidence corroborates the ocular account."" Trial court took note of the fact that the appellants and the members of the complainant party are related to each other closely. The dispute arose because of conflicting claims as to the ownership of the land. It was submitted that the occurrence took place when the members of the complainant party came forward and obstructed the appellant from doing the work and restrained them from pulling out the pipe. There was exchange of hot words and in the process, the occurrence, according to the prosecution, took place. In essence it was submitted that the accused were exercising the right of private defence or in the alternative the occurrence took place in the course of a sudden quarrel. Stand of the State was that there appears to be some exchange of words. The trial court found substance in the plea and found the accused persons guilty. Before the High Court it was submitted that the factual scenario has not been correctly appreciated by the trial court. It noted that the appellants pulled out the iron and plastic pipes which were installed on the land jointly owned by both the parties. Since the accused persons pulled out the pipes it was natural that the members of the complainant party who were standing at a distance of 16 to 35 feets from the appellants intervened and asked them not to pull out the pipes unless the elders take a decision. The appellants did not pay any heed.",query,5108,"these appeals are directed against the judgment of a high court whereby an appeal and a criminal revision were disposed of. the appellants were found guilty and sentenced to undergo various terms of sentences. the criminal appeal was filed by three appellants questioning the conviction and sentence as recorded. complainant filed a revision petition stating that she was entitled to compensation. background facts giving rise to the trial are essentially as follows: the complainant and the appellants are first cousins, and as such are closely related to each other. their grandfather was p1. as per site plans ex. pp prepared by p2, p3 pw4 and ex. pt prepared by p3 pw9 (i.0.), it shows that the place of occurrence was in the common land owned both by the appellants and the complainant party. the tube well of which the pipes were being taken out by the appellants, was also in the common piece of land. p4 (hereinafter referred to as deceased) was standing in the water-course point b (ex.pt). complainant p5 was standing in the common land point c (ex.pt) and p6 was standing at point d (ex. pt). it is the appellants who went 16 to 35 feet towards the complainants where deceased p4 and the other two witnesses p5 (pw6) and p6 (pw7) were standing and thereafter attacked them. p5 (pw6) asked the appellants not to take out the iron and plastic pipes of the tube well, but firstly to talk to the elders. malkiat singh, patwari (pw4), who is a key witness in regard to the ownership of the piece of land where the tubewell was installed, was not put any question regarding the ownership of the common land. p5 (pw6), in his testimony before the court, stated that the appellants on 7.1.2001 at about 1.00 p.m. armed with spades came to the tube well and started removing the pipes, which was jointly owned by both the appellants and complainant party. on being stopped, the appellants felt offended and attacked the complainant party. he (pw6) has further stated that there was no dispute regarding the joint property, but the appellants were not on visiting terms with them as far social functions were concerned. p4 was attacked in the joint water channel and across the water channel there was the field of p7, father of p8. after leaving the common pipes of land where the tube well was installed, rest of the land had been divided by both the parties and they were cultivating the land separately and peacefully. the complainant party did not have any weapons in their hands when they had gone to stop the appellants. this witness (pw6) has stated that they did not go near the appellants, but asked them not to remove the pipes. they were at that time standing at a distance of 5-6 karms. p6 (pw7) has also reiterated the same. p5 (pw6) has stated, that p9 and p10 have their fields at a distance of about half a kills from the place of occurrence. both these witnesses p5 (pw6) and p6 (pw7)",2903
AILA_Q25,"These appeals involving common questions of law and fact were taken up for hearing together and are being disposed of by this common judgment.  The lands situated inter alia in villages V1, V2, V3 and V4 were acquired by the State for the purpose of use thereof by the Appellant. A notification was issued on 31.7.1986. The declaration was issued on 29.12.1987. Upon service of notice upon the claimants, the Collector made an award. In doing so, several deeds of sale executed between 1981 and 1982 in respect of lands adjoining some of the villages were taken into consideration and market value of the land was determined at the rate of Rs. 1.55 per sq. m. The claimants Respondents did not accept the said award and prayed for a reference to the Civil Court. Such a reference having been made the Reference Court purported to be relying on or on the basis of judgments dated 30th October, 1996 and 10th November, 1996 passed by 4th Extra Assistant Judge and 2nd Extra Assistant Judge respectively in L.A. R. Case No. 1349/92 and 1314/92 passed an award computing the amount of compensation at the rate of Rs. 10/- per sq. m. The Appellant herein was not impleaded as a party in the Reference Court. It had, thus, no opportunity also to adduce any evidence either before the Land Acquisition Collector or before the Reference Court. It preferred appeals before the High Court being aggrieved by and dissatisfied with the said judgment and award passed by the Reference Court. A contention raised by the Appellant before the High Court inter alia was that the Reference Judge acted illegally and without jurisdiction in passing the said judgment solely on the basis of the deposition of one P1 who alleged that the agricultural lands which he and others had been cultivating were of high fertility and three crops in a year were grown therein. The witness further alleged that the village was well-developed. He further contended that the lands of one P2 was acquired for the Appellant wherein compensation at the rate of Rs. 10/- per sq. m. was awarded. It was argued that the Reference Court was bound to consider the deeds of sale relied upon by the Collector in his Award. High Court rejected the said contentions stating that the Reference Court had not committed any error of law in taking into consideration the evidence adduced by the said witness. It was held: ""It appears that after the evidence, another judgment was pointed to the Reference Court for which there is a reference in the impugned judgment. The lands covered under that reference cases were situated in the sim of village V1 and V5 and the Reference Court awarded Rs. 10/- per sq. mtrs. In the instant case, the lands are situated at village V1. In view of this evidence, we find no substance in the appeals and appeals are dismissed.""",query,2812,"these appeals involving common questions of law and fact were taken up for hearing together and are being disposed of by this common judgment. the lands situated inter alia in villages v1, v2, v3 and v4 were acquired by the state for the purpose of use thereof by the appellant. a notification was issued on 31.7.1986. the declaration was issued on 29.12.1987. upon service of notice upon the claimants, the collector made an award. in doing so, several deeds of sale executed between 1981 and 1982 in respect of lands adjoining some of the villages were taken into consideration and market value of the land was determined at the rate of rs. 1.55 per sq. m. the claimants respondents did not accept the said award and prayed for a reference to the civil court. such a reference having been made the reference court purported to be relying on or on the basis of judgments dated 30th october, 1996 and 10th november, 1996 passed by 4th extra assistant judge and 2nd extra assistant judge respectively in l.a. r. case no. 134992 and 131492 passed an award computing the amount of compensation at the rate of rs. 10- per sq. m. the appellant herein was not impleaded as a party in the reference court. it had, thus, no opportunity also to adduce any evidence either before the land acquisition collector or before the reference court. it preferred appeals before the high court being aggrieved by and dissatisfied with the said judgment and award passed by the reference court. a contention raised by the appellant before the high court inter alia was that the reference judge acted illegally and without jurisdiction in passing the said judgment solely on the basis of the deposition of one p1 who alleged that the agricultural lands which he and others had been cultivating were of high fertility and three crops in a year were grown therein. the witness further alleged that the village was well-developed. he further contended that the lands of one p2 was acquired for the appellant wherein compensation at the rate of rs. 10- per sq. m. was awarded. it was argued that the reference court was bound to consider the deeds of sale relied upon by the collector in his award. high court rejected the said contentions stating that the reference court had not committed any error of law in taking into consideration the evidence adduced by the said witness. it was held: it appears that after the evidence, another judgment was pointed to the reference court for which there is a reference in the impugned judgment. the lands covered under that reference cases were situated in the sim of village v1 and v5 and the reference court awarded rs. 10- per sq. mtrs. in the instant case, the lands are situated at village v1. in view of this evidence, we find no substance in the appeals and appeals are dismissed.",2804
AILA_Q26,"The hearing before us now relates to certain objections filed to the Award made by a former Judge of this Court who was appointed the sole arbitrator to adjudicate upon the dispute between the parties pursuant to the Order of this Court dated 18th November, 1987 in the circumstances as set out hereinafter. In order to appreciate the objections, it is necessary to refer to certain facts. The Settlement Commissioner llotted Plot No. 631 at L1 measuring 160 sq. yds to the Respondent under the Settlement Scheme for the refugees from Pakistan for a total price of Rs.4,800. This allotment was made by the Settlement Commissioner on behalf of the Rehabilitation Department of the Government. The Respondent applied for a loan from the Ministry of Defence for construction of the house on the said plot and a loan of Rs.15,000 was sanctioned in his favour. Under the House Construction Rules of the Government, the plans and estimates had to be submitted along with the application and a sanctioned amount was paid in four instalments at different stages of construction. The Respondent started the construction of a building on the said land. By the end of 1973, the Respondent had constructed a house on the said plot upto the roof level. By that time he had obtained and used up a sum of Rs.12,000 out of the loan sanctioned to him and only a balance of Rs.3,000 remained to be paid to him under the said loan. According to the Respondent, this amount was not sufficient for the final completion of the house and he, therefore, sought the help of Appellant No. I who advanced a sum of Rs.5,000 to him. In September, 1973 the Respondent entered into an agreement dated September 6, 1973 to sell the house and the said plot to the Appellant No. 1. The aforesaid amount of Rs.5,000 given by way of loan was shown in that agreement as an advance paid towards the sale price. The Respondent also executed a General Power of Attorney in favour of Appellant No. 1 inter alia enabling him to carry on construction work on the said land on behalf of the Respondent. According to the Respondent, the house was not complete but the Appellants who are husband and wife were occupying the same. Under circumstances, we need not discuss here, on January 29, 1974 another agreement was entered into between Appellant No. 1 and the Respondent which has been described as an agreement for construction. Under that agreement, Rs.80,000 was to be paid by the Respondent as the price of the construction to be put up by Appellant No. I on the said plot and he was to charge Rs.20,000 as the profits and labour charges. He was to deposit Rs.15,000 with the Respondent, this transaction was sham and bogus. Disputes arose Respondent was to return the amount of Rs.1,15,000 within three years in a lump sum and on such payment, Appellant No. I was to hand over the possession of the building and the plot to the Respondent. Till that amount was paid, Appellant No. 1 was entitled to possess and occupy and enjoy the same and to receive rents thereof. According to the Respondent, this transaction was sham and bogus. Disputes arose between the parties and the Respondent filed a suit in August 1977 claiming for the return of the possession of the said plot and the house. A notice of motionfor stay taken out by the Appellants was dismissed. An appeal was preferred against the said decision. In the appeal, which came up for hearing before the Additional District Judge. With the consent of the parties, P1 was appointed as the sole arbitrator to adjudicate upon the disputes in the suit. The said P1 died in July 1979 without making any award. On an application by the Respondent, the learned Additional District Judge filled up the vacancy by appointing P2, Advocate, as the sole arbitrator. P2 made and published his award which went against the Appellants. According to the Appellants, the said award was made ex parte. The appellants challenged the award by filing objectionsbefore the learned Additional District Judge and applied for setting aside the said award. This application was dismissed by the learned Additional District Judge. The Appellants filed an appeal against this decision on October 14,1982 before the High Court but the said appeal was dismissed by the learned Single Judge of that High Court on April 30, 1985. This decision of the learned Single Judge was challenged before this Court by way of Special Leave Petition. Leave was granted and the present Appeal came to be numbered as aforesaid. This Appeal came up for hearing before a Division Bench of this Court on November 18,1987. After hearing Counsel for the parties. in order to ensure fairplay in the action, this Court set aside the award of the Arbitrator and also the judgment of the High Court and appointed a former Judge of this Court, as the sole arbitrator to adjudicate upon the disputes between the parties. The arbitrator was directed to make his award with short reasons within four months from the receipt of the the order. Certain other conditions like payment of compensation and additional expense were imposed on the Appellants. Pursuant to the said order of this Court, former judge entered upon the reference and made and made and published his award on March 18,1988. Under the said award, it was held that the Respondent was entitled to a sum of Rs.58,498.60p and interest on this amount at the rate of 18 per annum from the date of the reference to the date of the award which worked out to a sum of Rs.3,510. Taking into account the amount paid by the Respondent initially towards the arbitrator's remuneration and others costs and after setting off the dues of Appellants against the Respondent, it was held that the Respondent-claimant was entitled to recover possession of the disputed building from the Appellants and that a sum of Rs.57,753 was payable by the Appellants to the Respondent. It is this award which is challenged before us now.",query,5936,"the hearing before us now relates to certain objections filed to the award made by a former judge of this court who was appointed the sole arbitrator to adjudicate upon the dispute between the parties pursuant to the order of this court dated 18th november, 1987 in the circumstances as set out hereinafter. in order to appreciate the objections, it is necessary to refer to certain facts. the settlement commissioner llotted plot no. 631 at l1 measuring 160 sq. yds to the respondent under the settlement scheme for the refugees from pakistan for a total price of rs.4,800. this allotment was made by the settlement commissioner on behalf of the rehabilitation department of the government. the respondent applied for a loan from the ministry of defence for construction of the house on the said plot and a loan of rs.15,000 was sanctioned in his favour. under the house construction rules of the government, the plans and estimates had to be submitted along with the application and a sanctioned amount was paid in four instalments at different stages of construction. the respondent started the construction of a building on the said land. by the end of 1973, the respondent had constructed a house on the said plot upto the roof level. by that time he had obtained and used up a sum of rs.12,000 out of the loan sanctioned to him and only a balance of rs.3,000 remained to be paid to him under the said loan. according to the respondent, this amount was not sufficient for the final completion of the house and he, therefore, sought the help of appellant no. i who advanced a sum of rs.5,000 to him. in september, 1973 the respondent entered into an agreement dated september 6, 1973 to sell the house and the said plot to the appellant no. 1. the aforesaid amount of rs.5,000 given by way of loan was shown in that agreement as an advance paid towards the sale price. the respondent also executed a general power of attorney in favour of appellant no. 1 inter alia enabling him to carry on construction work on the said land on behalf of the respondent. according to the respondent, the house was not complete but the appellants who are husband and wife were occupying the same. under circumstances, we need not discuss here, on january 29, 1974 another agreement was entered into between appellant no. 1 and the respondent which has been described as an agreement for construction. under that agreement, rs.80,000 was to be paid by the respondent as the price of the construction to be put up by appellant no. i on the said plot and he was to charge rs.20,000 as the profits and labour charges. he was to deposit rs.15,000 with the respondent, this transaction was sham and bogus. disputes arose respondent was to return the amount of rs.1,15,000 within three years in a lump sum and on such payment, appellant no. i was to hand over the possession of the building and the plot to the respondent. till that amount",2919
